{
  "$schema": "./equipment-base.schema.json",
  "formatVersion": 1,
  "contentRevision": 4,
  "templates": [
    {
      "id": "dao_equipment.standard.weapon.v1",
      "name": "法兵",
      "slot": "weapon",
      "baseStats": [
        {
          "attr": "physicalAtk",
          "ranges": [
            {
              "level": 10,
              "normal": [
                116,
                149
              ],
              "enhanced": [
                127,
                164
              ]
            },
            {
              "level": 30,
              "normal": [
                233,
                299
              ],
              "enhanced": [
                256,
                328
              ]
            },
            {
              "level": 50,
              "normal": [
                350,
                450
              ],
              "enhanced": [
                385,
                495
              ]
            },
            {
              "level": 70,
              "normal": [
                466,
                599
              ],
              "enhanced": [
                512,
                658
              ]
            },
            {
              "level": 90,
              "normal": [
                583,
                749
              ],
              "enhanced": [
                641,
                823
              ]
            },
            {
              "level": 110,
              "normal": [
                700,
                899
              ],
              "enhanced": [
                769,
                988
              ]
            },
            {
              "level": 130,
              "normal": [
                816,
                1049
              ],
              "enhanced": [
                898,
                1153
              ]
            },
            {
              "level": 150,
              "normal": [
                933,
                1199
              ],
              "enhanced": [
                1026,
                1318
              ]
            },
            {
              "level": 170,
              "normal": [
                1050,
                1349
              ],
              "enhanced": [
                1155,
                1483
              ]
            }
          ]
        },
        {
          "attr": "magicAtk",
          "ranges": [
            {
              "level": 10,
              "normal": [
                25,
                33
              ],
              "enhanced": [
                28,
                36
              ]
            },
            {
              "level": 30,
              "normal": [
                52,
                67
              ],
              "enhanced": [
                57,
                73
              ]
            },
            {
              "level": 50,
              "normal": [
                78,
                100
              ],
              "enhanced": [
                85,
                110
              ]
            },
            {
              "level": 70,
              "normal": [
                105,
                135
              ],
              "enhanced": [
                115,
                148
              ]
            },
            {
              "level": 90,
              "normal": [
                130,
                168
              ],
              "enhanced": [
                143,
                184
              ]
            },
            {
              "level": 110,
              "normal": [
                156,
                202
              ],
              "enhanced": [
                172,
                221
              ]
            },
            {
              "level": 130,
              "normal": [
                182,
                236
              ],
              "enhanced": [
                201,
                258
              ]
            },
            {
              "level": 150,
              "normal": [
                209,
                269
              ],
              "enhanced": [
                230,
                295
              ]
            },
            {
              "level": 170,
              "normal": [
                235,
                303
              ],
              "enhanced": [
                259,
                332
              ]
            }
          ]
        },
        {
          "attr": "healPower",
          "ranges": [
            {
              "level": 10,
              "normal": [
                30,
                54
              ],
              "enhanced": [
                33,
                59
              ]
            },
            {
              "level": 30,
              "normal": [
                60,
                108
              ],
              "enhanced": [
                66,
                118
              ]
            },
            {
              "level": 50,
              "normal": [
                90,
                162
              ],
              "enhanced": [
                99,
                178
              ]
            },
            {
              "level": 70,
              "normal": [
                120,
                216
              ],
              "enhanced": [
                132,
                237
              ]
            },
            {
              "level": 90,
              "normal": [
                150,
                270
              ],
              "enhanced": [
                165,
                297
              ]
            },
            {
              "level": 110,
              "normal": [
                180,
                324
              ],
              "enhanced": [
                198,
                357
              ]
            },
            {
              "level": 130,
              "normal": [
                210,
                378
              ],
              "enhanced": [
                231,
                416
              ]
            },
            {
              "level": 150,
              "normal": [
                240,
                432
              ],
              "enhanced": [
                264,
                476
              ]
            },
            {
              "level": 170,
              "normal": [
                270,
                486
              ],
              "enhanced": [
                297,
                535
              ]
            }
          ]
        }
      ]
    },
    {
      "id": "dao_equipment.standard.head.v1",
      "name": "法冠",
      "slot": "head",
      "baseStats": [
        {
          "attr": "maxMp",
          "ranges": [
            {
              "level": 10,
              "normal": [
                116,
                149
              ],
              "enhanced": [
                127,
                164
              ]
            },
            {
              "level": 30,
              "normal": [
                233,
                299
              ],
              "enhanced": [
                256,
                328
              ]
            },
            {
              "level": 50,
              "normal": [
                350,
                450
              ],
              "enhanced": [
                385,
                495
              ]
            },
            {
              "level": 70,
              "normal": [
                466,
                599
              ],
              "enhanced": [
                512,
                658
              ]
            },
            {
              "level": 90,
              "normal": [
                583,
                749
              ],
              "enhanced": [
                641,
                823
              ]
            },
            {
              "level": 110,
              "normal": [
                700,
                899
              ],
              "enhanced": [
                769,
                988
              ]
            },
            {
              "level": 130,
              "normal": [
                816,
                1049
              ],
              "enhanced": [
                898,
                1153
              ]
            },
            {
              "level": 150,
              "normal": [
                933,
                1199
              ],
              "enhanced": [
                1026,
                1318
              ]
            },
            {
              "level": 170,
              "normal": [
                1050,
                1349
              ],
              "enhanced": [
                1155,
                1483
              ]
            }
          ]
        },
        {
          "attr": "physicalDef",
          "ranges": [
            {
              "level": 10,
              "normal": [
                17,
                22
              ],
              "enhanced": [
                19,
                24
              ]
            },
            {
              "level": 30,
              "normal": [
                35,
                45
              ],
              "enhanced": [
                38,
                49
              ]
            },
            {
              "level": 50,
              "normal": [
                52,
                67
              ],
              "enhanced": [
                57,
                73
              ]
            },
            {
              "level": 70,
              "normal": [
                70,
                90
              ],
              "enhanced": [
                77,
                99
              ]
            },
            {
              "level": 90,
              "normal": [
                87,
                112
              ],
              "enhanced": [
                95,
                123
              ]
            },
            {